{
  "artifact_name": "controller-benchmark-condition-record-compile-receipt-v0",
  "compiled_on": "2026-04-02T15:58:03.657071+00:00",
  "script_path": "repo:/programs/partial-reprogramming-controller/scripts/controller_phase_stratified_compile_condition_records.py",
  "inputs": {
    "study_corpus": "repo:/programs/partial-reprogramming-controller/benchmarks/phase-stratified-controller-benchmark-v0/controller-benchmark-study-corpus-v0.csv",
    "negative_families": "repo:/programs/partial-reprogramming-controller/benchmarks/phase-stratified-controller-benchmark-v0/controller-benchmark-negative-family-registry-v0.json",
    "conditions": "repo:/programs/partial-reprogramming-controller/benchmarks/phase-stratified-controller-benchmark-v0/controller-benchmark-condition-fixture-v0.jsonl",
    "compiler_rules_dir": "repo:/programs/partial-reprogramming-controller/benchmarks/phase-stratified-controller-benchmark-v0/compiler-rules"
  },
  "outputs": {
    "condition_records": "repo:/programs/partial-reprogramming-controller/benchmarks/phase-stratified-controller-benchmark-v0/controller-benchmark-condition-records-v0.jsonl",
    "receipt": "repo:/programs/partial-reprogramming-controller/benchmarks/phase-stratified-controller-benchmark-v0/controller-benchmark-condition-record-compile-receipt-v0.json",
    "coverage_trust_receipt": "repo:/programs/partial-reprogramming-controller/benchmarks/phase-stratified-controller-benchmark-v0/controller-benchmark-compiler-coverage-trust-receipt-v0.json"
  },
  "condition_fixture_count": 8,
  "compiled_condition_record_count": 8,
  "source_kind_counts": {
    "study_specific_rule": 8
  },
  "claim": "This compile step preserves source trace and provenance for benchmarked conditions and now supports study-specific rule packs. It does not yet claim direct matrix-derived accession extraction."
}